{
  "kind": "modeler-project",
  "version": 1,
  "name": "boltworks-advanced-sports-car",
  "savedAt": "2026-07-21T00:00:00.000Z",
  "textureLibrary": [],
  "scene": {
    "version": 2,
    "coordinateSystem": {
      "handedness": "right-handed",
      "units": "meters",
      "upAxis": "+Y",
      "groundPlane": "XZ",
      "rotationUnits": "degrees",
      "eulerOrder": "XYZ",
      "objectPositions": "world space",
      "geometryAndPivots": "object-local space"
    },
    "groups": [
      { "id": "car", "name": "Advanced Sports Car", "parentId": null },
      { "id": "chassis", "name": "Chassis", "parentId": "car" },
      { "id": "body", "name": "Bodywork", "parentId": "car" },
      { "id": "cockpit", "name": "Cockpit Glass", "parentId": "car" },
      { "id": "interior", "name": "Interior", "parentId": "car" },
      { "id": "wheels", "name": "Wheels", "parentId": "car" },
      { "id": "front-wheels", "name": "Front Axle", "parentId": "wheels" },
      { "id": "rear-wheels", "name": "Rear Axle", "parentId": "wheels" },
      { "id": "aero", "name": "Aerodynamics", "parentId": "car" },
      { "id": "lighting", "name": "Lighting", "parentId": "car" },
      { "id": "mechanical", "name": "Mechanical", "parentId": "car" },
      { "id": "details", "name": "Exterior Details", "parentId": "car" }
    ],
    "objects": [
      { "id": "chassis-spine", "name": "Chassis central spine", "shape": "box", "position": [0, 0.48, 0], "rotation": [0, 0, 0], "scale": [5.8, 0.22, 1.25], "color": "#20272d", "roughness": 0.72, "groupId": "chassis", "groupName": "Chassis" },
      { "id": "chassis-floor", "name": "Chassis floor pan", "shape": "box", "position": [-0.1, 0.58, 0], "rotation": [0, 0, 0], "scale": [4.8, 0.16, 2.3], "color": "#30383f", "roughness": 0.78, "groupId": "chassis", "groupName": "Chassis" },
      { "id": "front-subframe", "name": "Front subframe", "shape": "box", "position": [2.05, 0.58, 0], "rotation": [0, 0, 0], "scale": [1.25, 0.28, 2.15], "color": "#272f35", "roughness": 0.75, "groupId": "chassis", "groupName": "Chassis" },
      { "id": "rear-subframe", "name": "Rear subframe", "shape": "box", "position": [-2.0, 0.58, 0], "rotation": [0, 0, 0], "scale": [1.35, 0.3, 2.18], "color": "#272f35", "roughness": 0.75, "groupId": "chassis", "groupName": "Chassis" },
      { "id": "front-axle", "name": "Front axle", "shape": "cylinder", "position": [1.75, 0.72, 0], "rotation": [90, 0, 0], "scale": [0.12, 2.95, 0.12], "color": "#7b858d", "roughness": 0.35, "groupId": "chassis", "groupName": "Chassis" },
      { "id": "rear-axle", "name": "Rear axle", "shape": "cylinder", "position": [-1.75, 0.72, 0], "rotation": [90, 0, 0], "scale": [0.14, 2.95, 0.14], "color": "#7b858d", "roughness": 0.35, "groupId": "chassis", "groupName": "Chassis" },
      { "id": "battery-tray", "name": "Battery tray", "shape": "box", "position": [0, 0.7, 0], "rotation": [0, 0, 0], "scale": [1.55, 0.34, 1.25], "color": "#181d21", "roughness": 0.8, "groupId": "chassis", "groupName": "Chassis" },

      { "id": "body-core", "name": "Sculpted lower body", "shape": "box", "position": [0, 0.98, 0], "rotation": [0, 0, 0], "scale": [5.25, 0.72, 2.38], "color": "#b5122d", "roughness": 0.28, "groupId": "body", "groupName": "Bodywork" },
      { "id": "front-nose", "name": "Tapered front nose", "shape": "pyramidFrustum", "position": [2.72, 0.92, 0], "rotation": [0, 0, -90], "scale": [1.35, 1.15, 2.15], "color": "#d21c3d", "roughness": 0.24, "groupId": "body", "groupName": "Bodywork" },
      { "id": "hood", "name": "Long hood", "shape": "wedge", "position": [1.52, 1.33, 0], "rotation": [0, 0, -4], "scale": [2.15, 0.42, 2.08], "color": "#cf1737", "roughness": 0.22, "groupId": "body", "groupName": "Bodywork" },
      { "id": "rear-deck", "name": "Rear deck", "shape": "wedge", "position": [-1.88, 1.28, 0], "rotation": [0, 180, 2], "scale": [1.65, 0.38, 2.12], "color": "#c71734", "roughness": 0.24, "groupId": "body", "groupName": "Bodywork" },
      { "id": "front-bumper", "name": "Front bumper beam", "shape": "box", "position": [3.04, 0.72, 0], "rotation": [0, 0, 0], "scale": [0.24, 0.34, 2.42], "color": "#11161b", "roughness": 0.62, "groupId": "body", "groupName": "Bodywork" },
      { "id": "rear-bumper", "name": "Rear bumper beam", "shape": "box", "position": [-2.83, 0.78, 0], "rotation": [0, 0, 0], "scale": [0.28, 0.38, 2.35], "color": "#161b20", "roughness": 0.6, "groupId": "body", "groupName": "Bodywork" },
      { "id": "left-side-skirt", "name": "Left side skirt", "shape": "box", "position": [0, 0.63, -1.27], "rotation": [0, 0, 0], "scale": [4.55, 0.22, 0.18], "color": "#11161b", "roughness": 0.5, "groupId": "body", "groupName": "Bodywork" },
      { "id": "right-side-skirt", "name": "Right side skirt", "shape": "box", "position": [0, 0.63, 1.27], "rotation": [0, 0, 0], "scale": [4.55, 0.22, 0.18], "color": "#11161b", "roughness": 0.5, "groupId": "body", "groupName": "Bodywork" },
      { "id": "left-door", "name": "Left door skin", "shape": "panel", "position": [0.05, 1.18, -1.22], "rotation": [0, 0, 0], "scale": [1.85, 0.82, 1], "color": "#c81736", "roughness": 0.24, "groupId": "body", "groupName": "Bodywork" },
      { "id": "right-door", "name": "Right door skin", "shape": "panel", "position": [0.05, 1.18, 1.22], "rotation": [0, 180, 0], "scale": [1.85, 0.82, 1], "color": "#c81736", "roughness": 0.24, "groupId": "body", "groupName": "Bodywork" },
      { "id": "left-front-fender", "name": "Left front wheel arch", "shape": "arch", "position": [1.75, 1.13, -1.25], "rotation": [0, 0, 0], "scale": [1.46, 0.7, 0.34], "color": "#d51b3c", "roughness": 0.22, "groupId": "body", "groupName": "Bodywork" },
      { "id": "right-front-fender", "name": "Right front wheel arch", "shape": "arch", "position": [1.75, 1.13, 1.25], "rotation": [0, 180, 0], "scale": [1.46, 0.7, 0.34], "color": "#d51b3c", "roughness": 0.22, "groupId": "body", "groupName": "Bodywork" },
      { "id": "left-rear-fender", "name": "Left rear wheel arch", "shape": "arch", "position": [-1.75, 1.14, -1.25], "rotation": [0, 0, 0], "scale": [1.52, 0.72, 0.34], "color": "#d51b3c", "roughness": 0.22, "groupId": "body", "groupName": "Bodywork" },
      { "id": "right-rear-fender", "name": "Right rear wheel arch", "shape": "arch", "position": [-1.75, 1.14, 1.25], "rotation": [0, 180, 0], "scale": [1.52, 0.72, 0.34], "color": "#d51b3c", "roughness": 0.22, "groupId": "body", "groupName": "Bodywork" },
      { "id": "roof", "name": "Low roof", "shape": "box", "position": [-0.25, 2.12, 0], "rotation": [0, 0, 0], "scale": [1.72, 0.18, 1.78], "color": "#8e1028", "roughness": 0.25, "groupId": "body", "groupName": "Bodywork" },
      { "id": "roof-scoop", "name": "Roof air scoop", "shape": "wedge", "position": [-0.45, 2.3, 0], "rotation": [0, 0, 0], "scale": [0.55, 0.2, 0.5], "color": "#171d22", "roughness": 0.38, "groupId": "body", "groupName": "Bodywork" },

      { "id": "windshield", "name": "Front windshield", "shape": "panel", "position": [0.57, 1.76, 0], "rotation": [-90, 60, 90], "scale": [1.58, 0.82, 0.38], "color": "#163948", "roughness": 0.12, "groupId": "cockpit", "groupName": "Cockpit Glass" },
      { "id": "rear-window", "name": "Rear windshield wedge", "shape": "wedge", "position": [-1.03, 1.76, 0], "rotation": [90, 60, -90], "scale": [1.56, 0.7, 0.06], "color": "#163948", "roughness": 0.12, "groupId": "cockpit", "groupName": "Cockpit Glass" },
      { "id": "left-window", "name": "Left side window", "shape": "panel", "position": [-0.2, 1.79, -0.85], "rotation": [0, 0, 0], "scale": [1.32, 0.47, 0.34], "color": "#112f3c", "roughness": 0.1, "groupId": "cockpit", "groupName": "Cockpit Glass" },
      { "id": "right-window", "name": "Right side window", "shape": "panel", "position": [-0.2, 1.79, 0.85], "rotation": [0, 180, 0], "scale": [1.32, 0.47, 0.34], "color": "#112f3c", "roughness": 0.1, "groupId": "cockpit", "groupName": "Cockpit Glass" },
      { "id": "left-quarter-window", "name": "Left quarter window", "shape": "panel", "position": [-1.02, 1.75, -0.84], "rotation": [0, 0, 12], "scale": [0.45, 0.36, 0.34], "color": "#112f3c", "roughness": 0.1, "groupId": "cockpit", "groupName": "Cockpit Glass" },
      { "id": "right-quarter-window", "name": "Right quarter window", "shape": "panel", "position": [-1.02, 1.75, 0.84], "rotation": [0, 180, -12], "scale": [0.45, 0.36, 0.34], "color": "#112f3c", "roughness": 0.1, "groupId": "cockpit", "groupName": "Cockpit Glass" },

      { "id": "driver-seat", "name": "Driver bucket seat", "shape": "capsule", "position": [-0.35, 1.25, -0.42], "rotation": [0, 0, -10], "scale": [0.43, 0.72, 0.5], "color": "#17191d", "roughness": 0.78, "groupId": "interior", "groupName": "Interior" },
      { "id": "passenger-seat", "name": "Passenger bucket seat", "shape": "capsule", "position": [-0.35, 1.25, 0.42], "rotation": [0, 0, -10], "scale": [0.43, 0.72, 0.5], "color": "#17191d", "roughness": 0.78, "groupId": "interior", "groupName": "Interior" },
      { "id": "driver-headrest", "name": "Driver headrest", "shape": "box", "position": [-0.68, 1.72, -0.42], "rotation": [0, 0, -8], "scale": [0.34, 0.38, 0.42], "color": "#202329", "roughness": 0.72, "groupId": "interior", "groupName": "Interior" },
      { "id": "passenger-headrest", "name": "Passenger headrest", "shape": "box", "position": [-0.68, 1.72, 0.42], "rotation": [0, 0, -8], "scale": [0.34, 0.38, 0.42], "color": "#202329", "roughness": 0.72, "groupId": "interior", "groupName": "Interior" },
      { "id": "dashboard", "name": "Dashboard", "shape": "box", "position": [0.48, 1.35, 0], "rotation": [0, 0, -7], "scale": [0.42, 0.34, 1.72], "color": "#20252a", "roughness": 0.65, "groupId": "interior", "groupName": "Interior" },
      { "id": "steering-wheel", "name": "Steering wheel", "shape": "torus", "position": [0.24, 1.48, -0.42], "rotation": [0, 90, 0], "scale": [0.46, 0.46, 0.46], "color": "#090b0d", "roughness": 0.58, "groupId": "interior", "groupName": "Interior" },